{
  "blocked_reason": null,
  "created_at": "2026-10-22T00:26:42Z",
  "defect_batch_id": null,
  "evidence_dir": "outcomes/quant-foundry-20261022T002642Z-fb32fce/",
  "findings": [
    {
      "detail": "sha256:611cedc127a33d4caa091a1b22d068e609a4de3f245536dae8b429978ed43adf",
      "evidence_paths": [],
      "id": "rubric-integrity",
      "kind": "integrity",
      "objective": true,
      "seconds": 0.0,
      "status": "pass",
      "title": "Rubric matches its review lock"
    },
    {
      "detail": "........                                                                 [100%]",
      "evidence_paths": [
        "research-gates.junit.xml",
        "research-gates.log"
      ],
      "id": "research-gates",
      "kind": "pytest",
      "objective": true,
      "seconds": 7.16,
      "status": "pass",
      "title": "Accounting reconciles, known scenarios, no lookahead, deterministic replay, costs included, all experiments recorded, rejected strategies visible, holdout sealed"
    },
    {
      "detail": "...........................                                              [100%]",
      "evidence_paths": [
        "harness.junit.xml",
        "harness.log"
      ],
      "id": "harness",
      "kind": "pytest",
      "objective": true,
      "seconds": 2.44,
      "status": "pass",
      "title": "State machine, idempotency, concurrency, intake authorization, outcome and memory guards"
    },
    {
      "detail": "secret scan: 0 finding(s)",
      "evidence_paths": [
        "secret-scan.log"
      ],
      "id": "secret-scan",
      "kind": "command",
      "objective": true,
      "seconds": 0.55,
      "status": "pass",
      "title": "No credentials in the repository or in the live site's shipped assets"
    },
    {
      "detail": "live site and snapshot reachable; snapshot matches state",
      "evidence_paths": [
        "live-site.json"
      ],
      "id": "live-site",
      "kind": "live",
      "objective": true,
      "seconds": 0.22,
      "status": "pass",
      "title": "Live Pages site loads and its data snapshot points at the state branch's latest run"
    },
    {
      "detail": "checked 15 published files for quant-foundry-20261022T002249Z-cbb8f255-a1; mismatches: none",
      "evidence_paths": [
        "published-matches-state.log"
      ],
      "id": "published-matches-state",
      "kind": "command",
      "objective": true,
      "seconds": 1.54,
      "status": "pass",
      "title": "Published result files are byte-identical to the accepted computation"
    },
    {
      "detail": "27 passed, 0 failed",
      "evidence_paths": [
        "e2e/summary.json"
      ],
      "id": "browser",
      "kind": "evidence-file",
      "objective": true,
      "seconds": 0.0,
      "status": "pass",
      "title": "Live-site browser checks at 390, 768 and 1440 px (states, interactions, keyboard, reduced motion, axe, overflow, console)"
    }
  ],
  "project": "quant-foundry",
  "release_id": "quant-foundry-20261022T002642Z-fb32fce",
  "repair_round": 0,
  "rubric_sha256": "sha256:611cedc127a33d4caa091a1b22d068e609a4de3f245536dae8b429978ed43adf",
  "run_id": "quant-foundry-20261022T002249Z-cbb8f255-a1",
  "source_commit": "fb32fce22260c8d0fe1b1f0d7aaade9d9b09ecef",
  "status": "released",
  "subjective": {
    "reason": "inference credentials are not configured for this repository",
    "scores": [],
    "status": "not_run"
  },
  "workflow_run_url": "https://github.com/mrrishit909/quant-foundry/actions/runs/39699308112"
}
